id,text,final_text
760,these were easier when my family could finally touch me and hold my hand.,easier family could finally touch hold hand .
761,"my foot was really hurting at this point ( and still is ), presumably from the running on saturday.","foot really hurting point still , presumably running saturday ."
762,"but i was still pepared to go to work, and i did; my condition was my own fault and i usually just grit my teeth and get on with my day.","still pepared go work , condition fault usually grit teeth get day ."
763,"& # x 26; nbsp; the moment my hand touched the faucet in the shower, julia is knocking away at the door.","x nbsp moment hand touched faucet shower , julia knocking away door ."
764,"the monster was right in front of me and gripped my arms tightly, giving me no chance to escape.","monster right front gripped arm tightly , giving chance escape ."
765,on saturday 15th january 2011 by evening my throat was in a bad shape.,saturday th january evening throat bad shape .
766,< 3 so i can now officially say that chicago holds my heart in more ways than one.,officially say chicago hold heart way one .
767,"makeing a sorta clam shell, or like someone praying but sideways., around my clentched fist.","makeing sorta clam shell , like someone praying sideways. , around clentched fist ."
768,fishin '' i woke up in the morning my head was throbing black and blue eyed thought i'd died smashed up my tv set.,fishin woke morning head throbing black blue eyed thought died smashed tv set .
769,"i didn't leave town this weekend, knowing it was going to rain ( thus my volunteer day today w / the homeless ) whilst my shoulder is all jacked up and clicking.i think i pinched at nerve at the gym.","leave town weekend , knowing going rain thus volunteer day today w homeless whilst shoulder jacked clicking.i think pinched nerve gym ."
770,apparently my leg had fallen asleep and i didn't know it.,apparently leg fallen asleep know .
771,"i was sitting in the van trying to stay warm, and going over the following day's logistics in my head.","sitting van trying stay warm , going following day logistics head ."
772,words that are dead lies to my heart.,word dead lie heart .
773,god i cant even see straight cuz i have so many tears in my eyes.,god cant even see straight cuz many tear eye .
774,"i don't feel as though i slighted the deities at the feast but i had no energy, was very depressed, and my heart wasn't in it.","feel though slighted deity feast energy , depressed , heart ."
775,my eyes well with tears.,eye well tear .
776,"the odd thing is that my sister's room is heavily carpeted, and honestly it's fairly difficult to smoothly push the door open.","odd thing sister room heavily carpeted , honestly fairly difficult smoothly push door open ."
777,"the hand rubbing my back eased the frantic pounding in my head, making me sigh after emptying everything in that toilet, stomach convulsing from the lack of content.","hand rubbing back eased frantic pounding head , making sigh emptying everything toilet , stomach convulsing lack content ."
778,"so i'm growing sleepy again and i rest my head on the coffee table, looking through the bars of the balcony and watching the sky turn orange and pink with the dark pine trees sticking out dark against the sky.","growing sleepy rest head coffee table , looking bar balcony watching sky turn orange pink dark pine tree sticking dark sky ."
779,"i filled it out and tried to stay calm, but my legs were still shaking!","filled tried stay calm , leg still shaking !"
780,this is where things start to get weird.,thing start get weird .
781,this is completely real.,completely real .
782,theyre gonna hit me up for money.,theyre gon na hit money .
783,"no water damage, sun damage, tears, anything.","water damage , sun damage , tear , anything ."
784,has this happened to anyone else?,happened anyone else ?
785,"after dousing my knee in aspercreme and a heated herbal pillow, it's stiff but doing better.","dousing knee aspercreme heated herbal pillow , stiff better ."
786,"still, the event was constantly played in my head.","still , event constantly played head ."
787,"let me put it this way: i burned so much as a kid that my nose is permanently red.i look back on all of this skin damage, and wish i could go back to my old self and do some kind of scared straight intervention.","let put way : burned much kid nose permanently red.i look back skin damage , wish could go back old self kind scared straight intervention ."
788,i changed and manage to get out of my iced over neighborhood to get there... i stand in the back putting food on trays and cursing under my breath every time i move my foot.,changed manage get iced neighborhood get stand back putting food tray cursing breath every time move foot .
789,"after a month at tables and t.v. trays, i was back on the ground, eating with my legs crossed, and had no complaints about it.","month table t.v . tray , back ground , eating leg crossed , complaint ."
790,"(but honestly, i can literally [not figuratively!","honestly , literally figuratively !"
791,wanted to quickly go home and hide my face.,wanted quickly go home hide face .
792,in college we had a lot of foreign students at school.,college lot foreign student school .
793,"but after blinking my eyes for a few times lepas tu tampar-tampar muka sikit, memang sah la yang penghantar itu hanis zalikha.","blinking eye time lepas tu tampar tampar muka sikit , memang sah la yang penghantar itu hani zalikha ."
794,and i was regret because i didn't listen to my heart.,regret listen heart .
795,"i said out loud, ""welcome"" and smiled.","said loud , welcome smiled ."
796,"gots no cash, gots no jobs, no place so get off my back and outta my face! ''","gots cash , gots job , place get back outta face !"
797,"my heart is clenched, a fist in its ribcage, i hold my breath, turn blue, i yield to you, my sacrifices culminate a slew, i crave you, cavegirl, when assumed assuage.","heart clenched , fist ribcage , hold breath , turn blue , yield , sacrifice culminate slew , crave , cavegirl , assumed assuage ."
798,"i can't stand the gelatinous tomato soup bit, or the soggy noodle letters, or the taste.","stand gelatinous tomato soup bit , soggy noodle letter , taste ."
799,"we end on a high note, laughing as i walked her back to her room, she thanks me for being a gentleman.","end high note , laughing walked back room , thanks gentleman ."
800,"i like these quiet moments, but i am not used to my head having so much quiet.","like quiet moment , used head much quiet ."
801,cant really forget the taste in my mouth!,cant really forget taste mouth !
802,"halfway through shoveling, i got '' living on a prayer '' stuck in my head.","halfway shoveling , got living prayer stuck head ."
803,"the redmond cycling club that organizes this event, had made-to-order coldcut sandwiches and -- be still my heart -- ice-cold cans of coca-cola at the final aid station.","redmond cycling club organizes event , made order coldcut sandwich still heart ice cold can coca cola final aid station ."
804,"out on an unpopulated barrier island that was barely anything more than mud, sand and mosquitoes.","unpopulated barrier island barely anything mud , sand mosquito ."
805,they both forgot to brick the door and he forgot his keycard.,forgot brick door forgot keycard .
806,... i need to get this list of shit that's happened off my chest.,need get list shit happened chest .
807,i walked out kamiyacho station with a big question mark in my head.,walked kamiyacho station big question mark head .
808,"*creepy/unnerving* that is, and just weird.","creepy unnerving , weird ."
809,my tongue had sucked it up and the hole was closed.,tongue sucked hole closed .
810,probably still awkward between them.,probably still awkward .
811,and probably murder me.,probably murder .
812,i nodded.i bowed my head at my seat.,nodded.i bowed head seat .
813,"we just say no and leave, quite shocked at that response.","say leave , quite shocked response ."
814,i was brought by to reality when noona hit my arm lightly.,brought reality noona hit arm lightly .
815,"like valene, liesl, meihui, jason etc. ( i can't remember alot ) i really think you guys are great people and you're the bestest friends in my heart.","like valene , liesl , meihui , jason etc . remember alot really think guy great people bestest friend heart ."
816,when i finally fell asleep again i had one last dream.,finally fell asleep one last dream .
817,"i think i got hit in the face with at least half the shells after i fired them, but even the hot metal briefly stinging me couldn't tear the grin off my face.","think got hit face least half shell fired , even hot metal briefly stinging tear grin face ."
818,it must be from lack of sleep last night because when i woke up there were dark circles around my eyes.,must lack sleep last night woke dark circle around eye .
819,slowly rising to my feet i came to the conclusion that sometimes being alone meant surviving for myself.,slowly rising foot came conclusion sometimes alone meant surviving .
820,"my head poked out of the grass again, catching sight of the men nearing my position, only about fifteen yards.","head poked grass , catching sight men nearing position , fifteen yard ."
821,it was so weird.,weird .
822,"like seriously, alot can not understand and im slow at registering words in my brain during that time, so yeah.","like seriously , alot understand im slow registering word brain time , yeah ."
823,i naively walked up and stuck my head in the driver's window hole.,naively walked stuck head driver window hole .
824,"i had a real crappy car years ago, the sun roof would leak, the air didn't work, it would keep running after i pulled the keys out, there was a hole in the front wind shield (i would keep an umbrella shoved in there to keep stuff from flying in).","real crappy car year ago , sun roof would leak , air work , would keep running pulled key , hole front wind shield would keep umbrella shoved keep stuff flying ."
825,this was merely seconds after the running up the stairs.,merely second running stair .
826,three of the civics move in to the right lane.,three civics move right lane .
827,i looked at my wrist.,looked wrist .
828,with my knees.,knee .
829,i will never forget that feeling.,never forget feeling .
830,"because i am breaking the pattern with someone who i care very much about, who hurt me on a very real level, and who finally opened my eyes to who i am.","breaking pattern someone care much , hurt real level , finally opened eye ."
831,"this 'star', starts to move across the sky.","star , start move across sky ."
832,"as i turned to walk out of the alley, a pair of brass knuckles crushed into the side of my face.","turned walk alley , pair brass knuckle crushed side face ."
833,"suddenly a silver can whizzed by my head, wetting me with watered down coors.","suddenly silver whizzed head , wetting watered coors ."
834,i slid my hand into my pocket and took out my knife.,slid hand pocket took knife .
835,"my hands were shaking and i could feel her hatred for me, almost radiating out of my computer screen.","hand shaking could feel hatred , almost radiating computer screen ."
836,"this is my first new it cert in two years or more, and now my head is back in the game, with the letters cssss posted after my name.","first new cert two year , head back game , letter cssss posted name ."
837,"down, into my stomach, churning until food no longer gave me pleasure or sustenance.",", stomach , churning food longer gave pleasure sustenance ."
838,we start riding toward the mtf and he is just getting even more ridiculous.,start riding toward mtf getting even ridiculous .
839,"= okay blablabla ~ and then, the dentist check up my teeth.","okay blablabla , dentist check teeth ."
840,"she said she agree with me but didn't know how to leave... to that, i shrugged my shoulders, shit i know how, pack your shit and leave... i mean, you know?","said agree know leave , shrugged shoulder , shit know , pack shit leave mean , know ?"
841,"this will probably get buried, but...","probably get buried ,"
842,i really hate my knee right now.,really hate knee right .
843,blood on my hands ( 2:16 ) 07.,blood hand : .
844,"one day she came over and brought a bag of random things to ""store"" at my house.",one day came brought bag random thing store house .
845,he leaps straight towards my eyes faster than anything i've ever seen before and i wake up feeling closer to death than i do my skin.,leap straight towards eye faster anything ever seen wake feeling closer death skin .
846,talked with a lady online and we decided to meet.,talked lady online decided meet .
847,"she would always scream and try to get him to swim across the river to her, but he refused.","would always scream try get swim across river , refused ."
848,"a flaming ball of fire shoots up my leg to my hip, back down and out my toes, and i involuntarily kick her!","flaming ball fire shoot leg hip , back toe , involuntarily kick !"
849,"my hands frostbitten, my ear peeling already from the cold.","hand frostbitten , ear peeling already cold ."
850,"i stopped for water at the rest stops and got doused with a hose, which was very pleasant except my shoes got drenched so i was running with heavy sponges on my feet for the last two miles.","stopped water rest stop got doused hose , pleasant except shoe got drenched running heavy sponge foot last two mile ."
851,i had to get on my knees and hang over the back of the seat.,get knee hang back seat .
852,"i want to take a class just to take one, so my brain isn't rotting away for a semester before the fire academy.","want take class take one , brain rotting away semester fire academy ."
853,i remember seeing wet cat food all over her croc shoes....only it wasn't cat food.,remember seeing wet cat food croc shoe cat food .
854,she got into a car crash and had a traumatic brain injury.,got car crash traumatic brain injury .
855,"^_^ i got up early today, it was too warm in my room and my ears were ringing terribly. >","^ ^ got early today , warm room ear ringing terribly ."
856,"when mike walked in the door, my heart skipped a beat and i had the biggest smile on my face.","mike walked door , heart skipped beat biggest smile face ."
857,i was scared shitless.,scared shitless .
858,"do you have a strange sleep schedule, have any sleep disorders, or sleep on your back?","strange sleep schedule , sleep disorder , sleep back ?"
859,"i knew we were almost there when my midwife's voice got more excited and joey leaned in real close and said into my ear, `` don't stop pushing! ''","knew almost midwife voice got excited joey leaned real close said ear , stop pushing !"
860,"so they decided to dabber in ""alternative"" medicine.",decided dabber alternative medicine .
861,"i snapped ending the call and throwing the phone on the sofa, i sat down and throw my head into my hands a few seconds later the phone rang again `` piss off ches!! ''","snapped ending call throwing phone sofa , sat throw head hand second later phone rang piss ches ! !"
862,"after crying for the better part of the night, my eyes are puffy and sensitive.","cry better part night , eye puffy sensitive ."
863,"the dentist ground down my teeth so they fit together and that relieved the symptoms but, of course, my teeth were then super-sensitive.","dentist ground teeth fit together relieved symptom , course , teeth super sensitive ."
864,"back when my son was first born, my wife and i purchased a new house and we were just moving in.","back son first born , wife purchased new house moving ."
865,"the giveaway drawing was supposed to be tonight, but since this day ran through my fingers at the rate of lightning, it's being extended until tomorrow... go here to enter.","giveaway drawing supposed tonight , since day ran finger rate lightning , extended tomorrow go enter ."
866,nothing but the dark.,nothing dark .
867,they were dancing to bolero.,dancing bolero .
868,we looked down and watched blood streaming down from under his shorts........,looked watched blood streaming short
869,i sell an incredible experience to my friends who are responsible enough to use it correctly.,sell incredible experience friend responsible enough use correctly .
870,"it shocked me the resistance i had to overcome to pull the sheet out, and when i got near the machine, my ears started turning up because of my earrings.","shocked resistance overcome pull sheet , got near machine , ear started turning earring ."
871,at this point my cousin notices that his house is decorated entirely with circus clowns.,point cousin notice house decorated entirely circus clown .
872,we saw this flock of seagulls poking at this bag of flaming hot cheetos.,saw flock seagull poking bag flaming hot cheetos .
873,i was writing away.,writing away .
874,"first, middle, and last.","first , middle , last ."
875,i have a huge bruise on my thigh.,huge bruise thigh .
876,his life was hell.,life hell .
877,3 ) the little old grannies that passed me up after my calves were shot.,little old granny passed calf shot .
878,and its freakin ' getting on my nerves.,freakin getting nerve .
879,my bedroom was next to the kitchen.,bedroom next kitchen .
880,thy walk today with me has made my heart within me burst; as i communed with thee.,thy walk today made heart within burst communed thee .
881,"on her way out of the church, she flags down the first car to pass...mine.","way church , flag first car pas mine ."
882,"i know lots of children have imaginary friends, but looking back on this feels very weird to me.","know lot child imaginary friend , looking back feel weird ."
883,so i cried my eyes out and did the drawing.,cried eye drawing .
884,the rest of the days in the week are spent just doing easy spins outside or on the trainer to flush out my legs.,rest day week spent easy spin outside trainer flush leg .
885,"her: yeah, i umm .",": yeah , umm ."
886,"to top it all off, my back started to sieze up, possibly due to compensation habits and stress worrying about the issue.","top , back started sieze , possibly due compensation habit stress worrying issue ."
887,and my throat felt a little funny but i ignored it and when i woke up this morning?,throat felt little funny ignored woke morning ?
888,or the darkness in my eyes.,darkness eye .
889,a hot wind like a blast from a steam oven tossed my sweat-damp hair back from my face.,hot wind like blast steam oven tossed sweat damp hair back face .
890,"when he drove through the night i would stay up with him and when it was late enough he would let me sit on his lap and let me ""drive"".",drove night would stay late enough would let sit lap let drive .
891,posted passive aggressively about me on facebook and sent me angry messages.,posted passive aggressively facebook sent angry message .
892,"( i was smart & bit my tongue ) oh, and great results, but i'm not going into details... ow.we spent all day together, and got pizza & a ton of beer for dinner!","smart bit tongue oh , great result , going detail ow.we spent day together , got pizza ton beer dinner !"
893,"so everytime someone tried to grab my hand with the camera in it, i just move it away from them lol.","everytime someone tried grab hand camera , move away lol ."
894,one day i was being tailgated by some jackass in a giant pickup truck.,one day tailgated jackass giant pickup truck .
895,"also in the room was the father and the grandparents, all also crying uncontrollably.","also room father grandparent , also cry uncontrollably ."
896,"my heart is racing, i get dizzy, my vision gets blurry, i can't communicate my thoughts right i panic, i can't breathe properly.","heart racing , get dizzy , vision get blurry , communicate thought right panic , breathe properly ."
897,i didn't see it move.,see move .
898,so i closed my eyes for a bit.,closed eye bit .
899,for months i stayed in the hospital bedridden.,month stayed hospital bedridden .
900,when i get really cold my back gets tense and starts to ache.,get really cold back get tense start ache .
901,your hacker saves your life and you become best friends.,hacker save life become best friend .
902,and my heart bleeds.,heart bleeds .
903,"the weekend didn't live up to my storm standards, i was all prepared to watch lots of movies and spend time with the new kitty and it barely rained on and off all weekend and unfortunately i was too sick to make it to beerfest, damn tabs really upset my stomach but i was grateful for ladies night and surely think it should be mandatory every weekend.","weekend live storm standard , prepared watch lot movie spend time new kitty barely rained weekend unfortunately sick make beerfest , damn tab really upset stomach grateful lady night surely think mandatory every weekend ."
904,we've never met.,never met .
905,"logically, i become bored.","logically , become bored ."
906,the texture of the water hitting my hands and running down into the sink makes me feel happy and comforted.,texture water hitting hand running sink make feel happy comforted .
907,my heart was just... beautiful.,heart beautiful .
908,murder is the better word.,murder better word .
909,it can repeat the same exacts movement of my hand when i drawed something or painted something that looked exactly the way i felt.,repeat exacts movement hand drawed something painted something looked exactly way felt .
910,"next it was running from a sadistic laugh, into cornfield, i trip, fall up.","next running sadistic laugh , cornfield , trip , fall ."
911,"anyway, a dream glitch?","anyway , dream glitch ?"
912,the next morning my right ear lobe swelled to twice its size and my ankles hurt.,next morning right ear lobe swelled twice size ankle hurt .
913,"when i first saw tangled on thanksgiving, it ate my brain.","first saw tangled thanksgiving , ate brain ."
914,here is where things get strange...,thing get strange
915,"`` yes, '' bruce agreed, and i suddenly gave him a hard shove, clenching my hands into fists at my sides.","yes , bruce agreed , suddenly gave hard shove , clenching hand fist side ."
916,"in one dream, i was pulling those long, white, stringy, watery stir-fry type vegetables out of my chest.","one dream , pulling long , white , stringy , watery stir fry type vegetable chest ."
917,i'm on the opposite end of the spectrum.,opposite end spectrum .
918,"i was almost last by the second corner, and i just put my head down to try and make some progress, but i couldn't do anything.","almost last second corner , put head try make progress , anything ."
919,like really i was so omfg half the time and was cringing and my face was squashed up half the time and i squeezed the blanket so hard until my right hand became numb.,like really omfg half time cringing face squashed half time squeezed blanket hard right hand became numb .
920,i will never ever forget that speed.,never ever forget speed .
921,i had hardly closed my eyes when i awoke to the sound of rain banging on the roof and the sound of my alarm going off at 7:30 am.,hardly closed eye awoke sound rain banging roof sound alarm going : .
922,"we decided to travel up a hill to explore, and as we were hanging out up on the hill it began to rain.","decided travel hill explore , hanging hill began rain ."
923,my leg was bleeding and for a while i pondered what kind of animals i was attracting with my blood scent.,leg bleeding pondered kind animal attracting blood scent .
924,but not even the entire content of my stomach.,even entire content stomach .
925,"i had been flung on top of the bike, and the handle bar was on my stomach.","flung top bike , handle bar stomach ."
926,"there's all this stuff i got ta do, and all the while there's this constant nagging thought in the back of my head ` should i really be here?","stuff got ta , constant nagging thought back head really ?"
927,luckily fellow first grade students were awesome and they either felt sorry for me or completely forgot about it the next day.,luckily fellow first grade student awesome either felt sorry completely forgot next day .
928,"we got married in california four and a half years ago, and we're still very much in love.","got married california four half year ago , still much love ."
929,"i managed to pull myself up, my leg was hurting, but only a little.","managed pull , leg hurting , little ."
930,"lately i've been going through the routine and motions of living for christ and believing it in my head, but my heart checked out a little bit ago.","lately going routine motion living christ believing head , heart checked little bit ago ."
931,"i, being a huge stephen king fan as well, began discussing different short stories and all of his amazing work.",", huge stephen king fan well , began discussing different short story amazing work ."
932,"i said in my heart, '' this too is meaningless. ''","said heart , meaningless ."
933,"i spent the night at the hotel, mostly hanging out in sandman & marian's room, trying to edit pics and meet about band merch while my tooth hurt cuz a filling fell out!","spent night hotel , mostly hanging sandman marian room , trying edit pic meet band merch tooth hurt cuz filling fell !"
934,"they find this man, still in her backseat, along with a shovel, rope and quicklime in the trunk.","find man , still backseat , along shovel , rope quicklime trunk ."
935,i really wanted to add him on facebook...,really wanted add facebook
936,but one criminal shoot from gun to my hand.,one criminal shoot gun hand .
937,i ended up crying and pissing on myself.,ended cry pissing .
938,"there were dozens of us, crying, screaming, or in shock.","dozen u , cry , screaming , shock ."
939,one day i was walking out to my car and i heard something hit the ground.,one day walking car heard something hit ground .
