id,text,final_text
0,she wanted to fight over every single little thing.,wanted fight every single little thing .
1,"anyway, back to tuesday.","anyway , back tuesday ."
2,she shrieked at the dog to go back.,shrieked dog go back .
3,"yelling for everyone to get back or get inside, i draw a knife from pocket and with my thumb i flip it open, a practice i'm used to after sea duty and my time in iraq.","yelling everyone get back get inside , draw knife pocket thumb flip open , practice used sea duty time iraq ."
4,still kind of freaky.,still kind freaky .
5,because it was fun.,fun .
6,"if she'd gone down into that basement, she probably would never have come back up.","gone basement , probably would never come back ."
7,just rip my heart out and stomp that sucker flat.,rip heart stomp sucker flat .
8,that's what's hanging over my head.,hanging head .
9,"i know not why, i wipe my face.","know , wipe face ."
10,"and i'm discovering all these little muscles in my back that i never knew existed, certainly not with such independent control as i'm discovering now.the product is fabulous.","discovering little muscle back never knew existed , certainly independent control discovering now.the product fabulous ."
11,my stomach... my back... legs... feet... and it feels like care unbundled.,stomach back leg foot feel like care unbundled .
12,i said sure thing.,said sure thing .
13,but my ankle has just about completely stopped hurting so i no longer have that excuse.,ankle completely stopped hurting longer excuse .
14,but the whole experience put a big smile on my face and i couldn't help but half smile all the way to store.,whole experience put big smile face help half smile way store .
15,"drawing my arm out from under me i push against him and adjust myself so that i am able to sit up and stare at him, playfully swatting at his stomach.","drawing arm push adjust able sit stare , playfully swatting stomach ."
16,see my thumbs.,see thumb .
17,apparently as soon as alcohol passes my lips i'm am no longer capable of working a toilet.,apparently soon alcohol pass lip longer capable working toilet .
18,i did scare the kid she danced with.,scare kid danced .
19,i took a step and my foot locked underneath a tree root.,took step foot locked underneath tree root .
20,it breaks my heart to think about it.,break heart think .
21,we stayed best friends like nothing ever happened.,stayed best friend like nothing ever happened .
22,"either way, the event surprised me.","either way , event surprised ."
23,chapter fouri rolled over in my bunk and yawned stretching my arms above me.,chapter fouri rolled bunk yawned stretching arm .
24,"more cigarettes and booze are brought into contact with my mouth, and then something new.","cigarette booze brought contact mouth , something new ."
25,the whole bathroom was very elegant and nicely decorated.,whole bathroom elegant nicely decorated .
26,i haven't seen bob since.,seen bob since .
27,i've found ways to help keep my knees in good condition ( saw the podiatrist and orthopedist ) and have incorporated exercise that's not as hard on my knees.,found way help keep knee good condition saw podiatrist orthopedist incorporated exercise hard knee .
28,they've clearly already seen us.,clearly already seen u .
29,but it was good; it kept me on my feet for a long while.knee?,good kept foot long while.knee ?
30,"if your family gets sick, please leave your door open.","family get sick , please leave door open ."
31,three kids died that day.,three kid died day .
32,"after we moved, they stopped immediately.","moved , stopped immediately ."
33,he seems nervous again.,seems nervous .
34,my ex girlfriend got pregnant.,ex girlfriend got pregnant .
35,the best i could offer was a small keloid scar on the meaty part of my palm from busting a glass while washing dishes.,best could offer small keloid scar meaty part palm busting glass washing dish .
36,"$ you $ '' i didn't hear, the blood is in my ears.","$ $ hear , blood ear ."
37,"the manager was at the till beside the front door, and the rest of us were mopping upstairs, cleaning tables and giving the staff toilet and stock room the once over.","manager till beside front door , rest u mopping upstairs , cleaning table giving staff toilet stock room ."
38,3 ) the little old grannies that passed me up after my calves were shot.,little old granny passed calf shot .
39,there was chinchilla poop *everywhere*.,chinchilla poop everywhere .
40,"yet, in the middle of math i wanted to put my head down and just fall asleep.","yet , middle math wanted put head fall asleep ."
41,"maybe i benefit from inflicting my suffering on my characters $ ) chapter fifteen i sat on the beneath a clouded night sky, knees tucked up to my chin, staring at the bloodstained patch of grass where james's body had fallen.","maybe benefit inflicting suffering character $ chapter fifteen sat beneath clouded night sky , knee tucked chin , staring bloodstained patch grass james body fallen ."
42,just rip my heart out and stomp that sucker flat.,rip heart stomp sucker flat .
43,"i yell ""whos there?!",yell who ? !
44,"chapter nine: honestly, when i was alive you could not have paid me to show my face at the community center.","chapter nine : honestly , alive could paid show face community center ."
45,it is certainly considerably different to work with as well and i have to keep certain rules in mind that i roll my eyes at when it comes to oils.,certainly considerably different work well keep certain rule mind roll eye come oil .
46,his girlfriend at the time convinced him to do it.,girlfriend time convinced .
47,"my hands, my lips, my touch these and are few to what it takes to build something no one can imagine.","hand , lip , touch take build something one imagine ."
48,""" the other boy clarified, ""sorry about him.","boy clarified , sorry ."
49,"it was a sad, strange experience.","sad , strange experience ."
50,it became a contest of pickled willpower.,became contest pickled willpower .
51,"i tried my best to keep my revulsion hidden, for things like that tend to turn my stomach, especially when the vendors claim that it is art.","tried best keep revulsion hidden , thing like tend turn stomach , especially vendor claim art ."
52,i saw it to.,saw .
53,one time my aunt was sitting on her front porch in her bare feet and she felt a lick.,one time aunt sitting front porch bare foot felt lick .
54,"i was intrigued and entertained the whole time, and a huge smile never left my face.","intrigued entertained whole time , huge smile never left face ."
55,the slight cardio made my lungs burn with pain.,slight cardio made lung burn pain .
56,drown them in blood.,drown blood .
57,i did wake up once and feel like my mouth tasted like old eggs.,wake feel like mouth tasted like old egg .
58,""" at me very aggressively.",aggressively .
59,"**stupid, retarded, no good very bad part of my brain:** hay look its a creepy thread i love these ones!!!!!!","stupid , retarded , good bad part brain : hay look creepy thread love one ! ! ! ! ! !"
60,others said with confidence that it was a drug deal gone bad.,others said confidence drug deal gone bad .
61,"i slammed my fist against the door and yelled, open up!","slammed fist door yelled , open !"
62,alarms rang in my head.,alarm rang head .
63,"i almost got my hands on the door handle, when i realized that i had left my adderall inside the hygiene bag in the bedroom.","almost got hand door handle , realized left adderall inside hygiene bag bedroom ."
64,fast forward to the second grade.,fast forward second grade .
65,"i tried to turn so i could get my feet in front of me, causing the rocks to slice the skin under my shirt.","tried turn could get foot front , causing rock slice skin shirt ."
66,we had absolutely nothing in common.,absolutely nothing common .
67,"i couldn't make out any clear distinct facial features, but i could see two darker circles where eyes would be, and a small oblong shape for a mouth.","make clear distinct facial feature , could see two darker circle eye would , small oblong shape mouth ."
68,the instant answer that fell out my mouth was a happy yes!,instant answer fell mouth happy yes !
69,there was also the sensation of something at my back at this point like a crustacean that i had to ask to leave.,also sensation something back point like crustacean ask leave .
70,"my face, i could almost swear, is still red, flushing.","face , could almost swear , still red , flushing ."
71,it overflowed and brown shitty diarrhea water came flooding under the stall wall into my wife's stall.,overflowed brown shitty diarrhea water came flooding stall wall wife stall .
72,"my ankle is feeling 100x better, but now my knee is ridiculous swollen.","ankle feeling x better , knee ridiculous swollen ."
73,"not only did standing around make me even colder, but my legs completely seized up and my stomach started to rumble.","standing around make even colder , leg completely seized stomach started rumble ."
74,he kept trying to grab me in the water and play fight.,kept trying grab water play fight .
75,i was now screaming at the top of my lungs.,screaming top lung .
76,waste of potential * sighs * but that's not even what broke my heart.,waste potential sigh even broke heart .
77,again i have a problem with the muscles in the back of my head behind my right ear.,problem muscle back head behind right ear .
78,"now, the gray woolen hat i wear to the barn has strings that hang all the way down over my chest with tassels on the end.",", gray woolen hat wear barn string hang way chest tassel end ."
79,than i let loose.,let loose .
80,"by the time i got done, my back was killing me ( but then it has been a problem since the last week of december ) and i felt pretty ill, but i got it done.","time got done , back killing problem since last week december felt pretty ill , got done ."
81,i had an extremely tame high school experience and this story seems to exemplify that.,extremely tame high school experience story seems exemplify .
82,"now my parents live in the foothills, and the college is in a large valley.","parent live foothill , college large valley ."
83,"wearing my clothes (not swim shorts), and my hair was brown (my hair is black when wet).","wearing clothes swim short , hair brown hair black wet ."
84,"suddenly i felt this weight on my head and i yelled, `` a pigeon just landed on my head. ''","suddenly felt weight head yelled , pigeon landed head ."
85,women i dated never did this (it seems moronic as the lie would be exposed immediately) until this one.,woman dated never seems moronic lie would exposed immediately one .
86,it is stuck there in the back of my head with some other nasty stuff.,stuck back head nasty stuff .
87,before i knew it i was on my hands and knees and someone close to me let out a terrible grunt at the same time.,knew hand knee someone close let terrible grunt time .
88,"in lifestories, 206 ) i nicked my ankle while shaving.","lifestories , nicked ankle shaving ."
89,i walked to the elevator with my arm around my mother's waist.,walked elevator arm around mother waist .
90,it got so bad that in the car on the way home i had to put the air on full blast and put my head down in the car to try to keep it cool so it didn't ich so much.,got bad car way home put air full blast put head car try keep cool ich much .
91,he died that night.,died night .
92,i was hungry and freezing.,hungry freezing .
93,our classmate mark had passed away late last night in his sleep.,classmate mark passed away late last night sleep .
94,"there is something lurking in my heart that is still very, very angry with him.","something lurking heart still , angry ."
95,"along with pete seeger and jim white, bsp was one of the first shows that s ren went to ( out of my belly ).","along pete seeger jim white , bsp one first show ren went belly ."
96,"so i go trotting outside, in my not so warm pj's to untangle the dumb dog when i take a step down the stair and my ankle folds ( yes, the same ankle that i hurt a year ago ), my ankle folds and i end up in a snow bank.","go trotting outside , warm pj untangle dumb dog take step stair ankle fold yes , ankle hurt year ago , ankle fold end snow bank ."
97,( you know who you ladies are ) tracy brought out the very first picture of an angel and it brought tears to my eyes.,know lady tracy brought first picture angel brought tear eye .
98,"the feeling of my hand over the net, feeling the net between my hand and my pleasure, not letting me through enough, but letting me through just enough.","feeling hand net , feeling net hand pleasure , letting enough , letting enough ."
99,my ex girlfriend got pregnant.,ex girlfriend got pregnant .
100,i tried to be an easy going bride.,tried easy going bride .
101,not much further down the road. i looked back over my shoulder.,much road . looked back shoulder .
102,this little kid around 6 yrs.,little kid around yr .
103,the man was baffled.,man baffled .
104,a full internal world like this is great escapism.,full internal world like great escapism .
105,everyone watched me dance on the stage but for some reason they couldn't see past the scars from my arms to my stomach to my legs i didn't realize that everyone knew what i was doing.,everyone watched dance stage reason see past scar arm stomach leg realize everyone knew .
106,"for a short time, i got lost in the moment, marveling in the joy i saw in all the faces that ran past i screamed and almost jumped out of my skin.","short time , got lost moment , marveling joy saw face ran past screamed almost jumped skin ."
107,to get to the backdoor of her house you need to go through the driveway gate that is huge and is very loud.,get backdoor house need go driveway gate huge loud .
108,and i thought i had the whole world in my hand.,thought whole world hand .
109,i'm just numb.,numb .
110,can't wait to be in another wedding!,wait another wedding !
111,"when i want to, i can touch my toes down on the ground ( bend over and touch toes ).","want , touch toe ground bend touch toe ."
112,""" she responded back in jest ""what the hell?",responded back jest hell ?
113,my world did nt stop spinning but my heart was indeed hurt.,world nt stop spinning heart indeed hurt .
114,as i go to take the hook out of my 4th fish... it shakes and embeds the hook in my hand.,go take hook th fish shake embeds hook hand .
115,"i missed a lot because my tooth, which had been bugging me for a couple of days, decided to go nuts & i didn't have any pain killer with me.","missed lot tooth , bugging couple day , decided go nut pain killer ."
116,"this morning, i went to reach for a med bottle and was basically rendered breathless by a sharp ouchie feeling in my chest.","morning , went reach med bottle basically rendered breathless sharp ouchie feeling chest ."
117,"that last night, the bobby pins had apparently mostly fallen off, and his pants fell down.","last night , bobby pin apparently mostly fallen , pant fell ."
118,a former boxing coach for the soviet union.,former boxing coach soviet union .
119,right away warning alarms begin ringing in my brain.,right away warning alarm begin ringing brain .
120,"just glad it was all sorted out now, and they took off the extra i shouldn't have paid last month off this month, that's a lot of my back.","glad sorted , took extra paid last month month , lot back ."
121,"there was nothing else of mine in her belongings, and i stood up and dusted my hands off.","nothing else mine belonging , stood dusted hand ."
122,"i was angry at how she made me feel, i was angry that my eyes were all puffy and bloodshot when i woke up, i was angry that i had a cold shower.","angry made feel , angry eye puffy bloodshot woke , angry cold shower ."
123,one time in high school my friends and i had a dance party in someones basement.,one time high school friend dance party someone basement .
124,half the crowd was passionate and animated while the other wanted only to enjoy the company of their seats.,half crowd passionate animated wanted enjoy company seat .
125,i had chills running up and down my spine.,chill running spine .
126,"her closest coworker friend, ""w"", was getting married (w was like 25~26) and asked c to be one of her bridesmaids.","closest coworker friend , w , getting married w like asked c one bridesmaid ."
127,"first hit made everything feel comforting and light, i was confident and ready to take my next three hits.","first hit made everything feel comforting light , confident ready take next three hit ."
128,#name?,name ?
129,"none of us had... and then, years later my brain had changed, quite immensely.","none u , year later brain changed , quite immensely ."
130,the stranger crosses the finish line first; the crowd goes wild!,stranger cross finish line first crowd go wild !
131,"i looked about the room and the walls appeared bare i looked at my hands and found a pen clutched in them, i looked forward and could see my breath.","looked room wall appeared bare looked hand found pen clutched , looked forward could see breath ."
132,) she decides to start fucking with my feet.,decides start fucking foot .
133,"taking off my clothes, i ignored what the reflection of the mirror told me about my back and entered the shower.","taking clothes , ignored reflection mirror told back entered shower ."
134,by that point i felt like someone was stabbing my head with a sharp object.,point felt like someone stabbing head sharp object .
135,"then, he feels the upper part of my chest and says `` not wearing a necklace.",", feel upper part chest say wearing necklace ."
136,"i looked down at my hand, my vision blurred.","looked hand , vision blurred ."
137,one time a girl grabbed my hand and dragged me out onto the floor.,one time girl grabbed hand dragged onto floor .
138,"so i went to see dr. tabaa, and on the initial visit, he performed what could only be described as a physical, without the turning my head and coughing, and advised me to take magnesium.","went see dr. tabaa , initial visit , performed could described physical , without turning head coughing , advised take magnesium ."
139,i remember gritting my teeth because i was thinking about my mom being asleep over nine hours.,remember gritting teeth thinking mom asleep nine hour .
140,can't wait to be in another wedding!,wait another wedding !
141,the first semester i did just fine.,first semester fine .
142,"you took my breath and stole my heart, now i'm standin ' smoking in the rain, tryin to let go, tryin to kill the pain.","took breath stole heart , standin smoking rain , tryin let go , tryin kill pain ."
143,i live in an old 1800's farmhouse across the street from a small cemetery.,live old farmhouse across street small cemetery .
144,my legs started cramping then which cause me to do something which was totally idiotic.,leg started cramping cause something totally idiotic .
145,i had a bath in the worlds biggest tub ( i could lie straight out and not have to bend my legs!! ),bath world biggest tub could lie straight bend leg ! !
146,"i close my mouth in a fine line, remembering one line after another.","close mouth fine line , remembering one line another ."
147,one was my grandfather.,one grandfather .
148,never felt so depressed before.,never felt depressed .
149,"i ""woke up"" in my bed looking at my bedroom door.",woke bed looking bedroom door .
150,moral of the story?,moral story ?
151,he ended up sending me into severe depression where i was doubting everything about myself.,ended sending severe depression doubting everything .
152,"every time it happens, the beginning of the dream is a little longer.","every time happens , beginning dream little longer ."
153,"so i have paper towels taped to my legs and i decide that i need to get to the pharmacy i mean c'mon, i haven't been there yet today so i am overdue and i need to get some latex free gauze and tape.","paper towel taped leg decide need get pharmacy mean c mon , yet today overdue need get latex free gauze tape ."
154,"i have never seen him cry, ever.","never seen cry , ever ."
155,"i seriously have the biggest pooch at the bottom of my stomach, and it drive me crazy.##url## / / i33.tinypic.com / 6yh9ch.","seriously biggest pooch bottom stomach , drive crazy . url .tinypic.com yh ch ."
156,that was interesting comparatively 'cause of the fact that i can't extend my arms all the way or lift my hands above my shoulders.,interesting comparatively cause fact extend arm way lift hand shoulder .
157,i would go over to his house where his grandmother and mom and dad lived to play ssx tricky and eat pokemon fruit rollups.,would go house grandmother mom dad lived play ssx tricky eat pokemon fruit rollups .
158,by the time we landed in paris ( and for the next 3 weeks ) that is the only song i had in my head.,time landed paris next week song head .
159,the church was dark and empty.,church dark empty .
160,"i remember being able to put a pencil in my mouth and close my mouth completely, with either end of the pencil just sticking out.","remember able put pencil mouth close mouth completely , either end pencil sticking ."
161,they thought they were going to be helping him make an internet business.,thought going helping make internet business .
162,i can't remember.,remember .
163,we saw it hit the grass but never found it.,saw hit grass never found .
164,i did scare the kid she danced with.,scare kid danced .
165,"i was so joyous about the deluge of water from the sky last night, that i spent ample time relishing in it... throwing back my head, closing my eyes, and just letting it pour down on me.","joyous deluge water sky last night , spent ample time relishing throwing back head , closing eye , letting pour ."
166,"back in the 70s, my mom found a bag in my room.","back , mom found bag room ."
167,"my head whipped around, and there it was.","head whipped around , ."
168,i tracked him down and hospitalized him.,tracked hospitalized .
169,"one day while i was sleeping, i awoke to see him tinkering with tweezers in a small container.","one day sleeping , awoke see tinkering tweezer small container ."
170,didn't even bruise.,even bruise .
171,the commuter runs after his first aid kid and gets me something to clean my leg.,commuter run first aid kid get something clean leg .
172,"police got called, guy gets taken away.","police got called , guy get taken away ."
173,so i washed my face and freshened up.,washed face freshened .
174,i smiled and embraced myself as a single tear dripped down my cheek.,smiled embraced single tear dripped cheek .
175,right away warning alarms begin ringing in my brain.,right away warning alarm begin ringing brain .
176,things will get better!,thing get better !
177,when the dust settled i looked over at my wife and saw she was alive and i knew i was alive so i immediately had happiness in my heart.,dust settled looked wife saw alive knew alive immediately happiness heart .
178,the day was hot and still; the air lay close against my face.,day hot still air lay close face .
179,and the happy ending?,happy ending ?
180,"i was a red belt in taekwondo at this point which probably had something to do with it, but i've noticed over the years just how fast my reflexes are when i relax my brain and just let my muscle memory take over.","red belt taekwondo point probably something , noticed year fast reflex relax brain let muscle memory take ."
181,"those were days much like these days, in terms of work output, but my eyes were less sore after hours of engaging in the activity.hey!","day much like day , term work output , eye less sore hour engaging activity.hey !"
182,"i'm that forgotten tear that forgot to fall yet lingers on my cheek brush it away and it's still there lick it up, and feel it burn your throat, stripping it red raw.","forgotten tear forgot fall yet lingers cheek brush away still lick , feel burn throat , stripping red raw ."
183,"we'll a couple months later, he died.","couple month later , died ."
184,not the best idea for two reasons: ( a ) i don't get paid til next month and i can't afford to replace the door and ( b ) i'm more likely to breack my foot then the door and i'm not good at hopping.,best idea two reason : get paid til next month afford replace door b likely breack foot door good hopping .
185,both my hands and my left leg were amputated.,hand left leg amputated .
186,it was an very selfish move.,selfish move .
187,"i have incredibly pale skin, poor circulation in my lips, and blonde eyebrows and eyelashes.","incredibly pale skin , poor circulation lip , blonde eyebrow eyelash ."
188,"my goodness, at that point i was shocked beyond words and i believe i had an epic:o expression on my face.","goodness , point shocked beyond word believe epic : expression face ."
189,i remember the sweat burning in my eyes and trying to control my breathing.,remember sweat burning eye trying control breathing .
190,the first semester i did just fine.,first semester fine .
191,"broke up a bit later, pretty sure she was/is bipolar.","broke bit later , pretty sure bipolar ."
192,seriously... did i really just shut my finger in the car door.,seriously really shut finger car door .
193,"so, i was ten years old at the time.",", ten year old time ."
194,it was really strange since i braced to hit the wall and ended up falling to the ground.,really strange since braced hit wall ended falling ground .
195,that's messed up.,messed .
196,"the next thing i knew, a spoon full of cinnamon was in my mouth.","next thing knew , spoon full cinnamon mouth ."
197,"i was mad and when i put my hands together, fire appeared and i threw it.","mad put hand together , fire appeared threw ."
198,i used to babysit ben on a regular basis.,used babysit ben regular basis .
