id,text,final_text
377,"it was a slow time to poop but i mean, come on.","slow time poop mean , come ."
378,then they would leave and go to their own room obviously.,would leave go room obviously .
379,this was about 4-5 years ago?,year ago ?
380,"`` i was flat on my back, the wind knocked out of me, but somehow i managed to scramble to my hands and knees.","flat back , wind knocked , somehow managed scramble hand knee ."
381,i know this comment will be lost in all the others but i will contribute none the less.,know comment lost others contribute none less .
382,i begged to come with him to see the house.,begged come see house .
383,"somehow, while scrubbing the left side of my face with my left hand, my left pinkie went up my left nostril really, really fast and really, really hard, and drew blood.","somehow , scrubbing left side face left hand , left pinkie went left nostril really , really fast really , really hard , drew blood ."
384,( points to her palm for notebook and flashes ten fingers for blue's clues-which is what we do when we watch the show ) 4.,point palm notebook flash ten finger blue clue watch show .
385,i went walking the other day and froze my lungs out.,went walking day froze lung .
386,this will probably get buried but...,probably get buried
387,"i fainted, and my chest was very painful.","fainted , chest painful ."
388,"my legs felt good when i was done, and according to the hrm they burned off 960 calories in the 1hr10.","leg felt good done , according hrm burned calorie hr ."
389,i thought i died.,thought died .
390,i'm gonna absolutely ~~suck~~ be terrible during my first sexual experience ._.,gon na absolutely suck terrible first sexual experience . .
391,i browsed my back up drive for outlook files.,browsed back drive outlook file .
392,"this plan did not work, i managed to get about 2 hours of sleep all night ( likely because of the tylenol pm i had ) because i could not get my leg into a comfortable position at any point all night.","plan work , managed get hour sleep night likely tylenol pm could get leg comfortable position point night ."
393,"i extended my tongue, licked at the flesh, then pressed my lips closer to suck, to draw the skin and maybe a ball into my mouth.","extended tongue , licked flesh , pressed lip closer suck , draw skin maybe ball mouth ."
394,"i raced across the overhead bridge, keeping my eyes peeled for a taxi, and obviously, due to the nature of cosmic fate, my bus comes exactly as i reach the bus stop.","raced across overhead bridge , keeping eye peeled taxi , obviously , due nature cosmic fate , bus come exactly reach bus stop ."
395,the frequency never faltered.,frequency never faltered .
396,my mom actually works with a lady who was on the show bridezillas.,mom actually work lady show bridezillas .
397,my heart sank.,heart sank .
398,"i could hardly believe that after all this time, after so many seasons spent reaping despair, he was finally here, in my arms.","could hardly believe time , many season spent reaping despair , finally , arm ."
399,she picked up the phone and nobody was on the other end.,picked phone nobody end .
400,"sounding throughout the car was billy joel singing `` new york state of mind, '' as my eyes filled with tears.","sounding throughout car billy joel singing new york state mind , eye filled tear ."
401,`` i rolled my eyes to the heavens.,rolled eye heaven .
402,"i can only remember my eye getting swollen by a bug bite once before in my life, so i've really made great strides this week.","remember eye getting swollen bug bite life , really made great stride week ."
403,"they called to her to leave her vehicle slowly, without panicking, and walk towards them.","called leave vehicle slowly , without panicking , walk towards ."
404,my ex boyfriend has been texting me every single day for a month continuously.,ex boyfriend texting every single day month continuously .
405,it looks like dark smelly applesauce.,look like dark smelly applesauce .
406,i go in and sit down at my usual seat.,go sit usual seat .
407,this story was told by my mum and step dad.,story told mum step dad .
408,"my boyfriend prepared cornish game hens, lobsters, and steak for lunch every day.","boyfriend prepared cornish game hen , lobster , steak lunch every day ."
409,"he had glowing eyes that were pitch black, and a face like any other human.","glowing eye pitch black , face like human ."
410,i woke up soon after with little to no memory of it.,woke soon little memory .
411,"not only was i not able to move, i smacked my head against the guy sitting in front me and things just got awkward.","able move , smacked head guy sitting front thing got awkward ."
412,"we clue in that the surrounding forest is dry as a bone, since it hasn't rained a drop in at least two weeks.","clue surrounding forest dry bone , since rained drop least two week ."
413,so i tucked my fingers into a ball in my lobster claws and started to jog in the snow with my bike down the road.,tucked finger ball lobster claw started jog snow bike road .
414,so what happens is we get there.,happens get .
415,so there's that...,
416,i stopped rising about two feet above the bed.,stopped rising two foot bed .
417,i drive over to the party early (to help set up) and she's not there yet.,drive party early help set yet .
418,my dad saved my life when i was 9.,dad saved life .
419,it's not even a conscious thing.,even conscious thing .
420,"just glad it was all sorted out now, and they took off the extra i shouldn't have paid last month off this month, that's a lot of my back.","glad sorted , took extra paid last month month , lot back ."
421,' that infuriated me so much as i was frazzled out of my head so much already.,infuriated much frazzled head much already .
422,my ear is not as super painful today but i'm still exhausted and sick feeling.,ear super painful today still exhausted sick feeling .
423,"i don't mind conditioning, but with my hip?","mind conditioning , hip ?"
424,i had never had morphine before and was not bothered by the subtle burning feeling in my stomach as it entered into my system.,never morphine bothered subtle burning feeling stomach entered system .
425,the way you're seeing it is the way it actually appeared.,way seeing way actually appeared .
426,all i can do is shake my head and laugh about this and add it to the list of `` drama i'm happy to avoid right now.,shake head laugh add list drama happy avoid right .
427,i hid my face in my knees not letting the intruder see my current state.,hid face knee letting intruder see current state .
428,"i missed a lot because my tooth, which had been bugging me for a couple of days, decided to go nuts & i didn't have any pain killer with me.","missed lot tooth , bugging couple day , decided go nut pain killer ."
429,"buried, alone, and sad.","buried , alone , sad ."
430,"' ( today ) so the story of my grandparents ' illness continues... i'm scorching my tongue on coffee, and my head on looking at the screen.","today story grandparent illness continues scorching tongue coffee , head looking screen ."
431,but never with someone i'd almost dared to trust my heart to.,never someone almost dared trust heart .
432,"it was super strong, thinking about it makes my lungs burn.","super strong , thinking make lung burn ."
433,"i also injured my neck-it hurt so bad yesterday that it was all i could do for a few hours to sit in the recliner with a hot pad on my neck, watching friends and shoving max every time he jumped on my bruised thighs.","also injured neck hurt bad yesterday could hour sit recliner hot pad neck , watching friend shoving max every time jumped bruised thigh ."
434,"opening my eyes late in the midnight hours, i blink my eyes.","opening eye late midnight hour , blink eye ."
435,"prior to, we got some humongous popsicles which turned my tongue an amazing shade of blue, and we visited the children's a&s display.","prior , got humongous popsicle turned tongue amazing shade blue , visited child display ."
436,one day i was searching through my drawers in my room and i found a cassette tape of babar the elephant.,one day searching drawer room found cassette tape babar elephant .
437,"anyway, i finished up and went back inside and decided to brush my teeth and straighten my shirttail, which had gotten twisted while sitting on the floor of the hall reading for two hours.","anyway , finished went back inside decided brush teeth straighten shirttail , gotten twisted sitting floor hall reading two hour ."
438,i heard footsteps going down to the basement.,heard footstep going basement .
439,"**elderly man**: well, there's a lot of them colored folks working there, and i just didn't feel safe leaving it with them.","elderly man : well , lot colored folk working , feel safe leaving ."
440,they said they don't remember any man.,said remember man .
441,i could feel my heart breaking into millions of pieces.,could feel heart breaking million piece .
442,"this evening's first ride adventures include: almost running over a squirrel, near personal injuries involving the seat, bugs in my mouth, eyes, and nose, and a grand performance of maneuvering my bike up my stairs, around a tight corner, and into my living room","evening first ride adventure include : almost running squirrel , near personal injury involving seat , bug mouth , eye , nose , grand performance maneuvering bike stair , around tight corner , living room"
443,i remember swinging on the swings one day when i was in elementary school.,remember swinging swing one day elementary school .
444,i learned so much from these classes and now my head is spinning with ideas.,learned much class head spinning idea .
445,what did i see?,see ?
446,"i saw these three lights open up in the sky, like a perfect equilateral triangle.","saw three light open sky , like perfect equilateral triangle ."
447,"not too scary, right?","scary , right ?"
448,"ever the same ~ on december 16th, 2010, i fell on the ice in my drive way and broke my hip.","ever december th , , fell ice drive way broke hip ."
449,"meridian was a fashion-conscious girl, and stored all her dresses in an enormous, solid carved oak dresser, one of three in the dormitory sort of room the girls shared.","meridian fashion conscious girl , stored dress enormous , solid carved oak dresser , one three dormitory sort room girl shared ."
450,it always fell down.,always fell .
451,i shake my head and drop it to the bed.,shake head drop bed .
452,"didn't happen to me, but a friend.","happen , friend ."
453,my mind was blown.,mind blown .
454,"a couple of weeks later, i began to feel a knot coming up on my back by my spine, where the incision is for the catheter that was put in to the pump and then attached into my spine.","couple week later , began feel knot coming back spine , incision catheter put pump attached spine ."
455,i still can't figure it out.,still figure .
456,the light grew grater and what i saw under my eyelids caused grief.,light grew grater saw eyelid caused grief .
457,"i crossed my arms, smiled, tilted my head, and said, `` i thought you were supposed to be in austria? ''","crossed arm , smiled , tilted head , said , thought supposed austria ?"
458,"my brother snores and his snores are constant in one spot at the head of the bed, so it could not have been him.","brother snore snore constant one spot head bed , could ."
459,he knows what's happening and passes over a gel containing more than my average monthly dosage of caffeine and i pour the entire syrupy mixture down my throat.,know happening pass gel containing average monthly dosage caffeine pour entire syrupy mixture throat .
460,"i said the first thing that came into my head, ` ciao.","said first thing came head , ciao ."
461,`` i like my toes.,like toe .
462,"we went out for mexican food and margaritas; i had most of my margarita on an empty stomach, and it really went to my head.","went mexican food margarita margarita empty stomach , really went head ."
463,i found it fascinating.,found fascinating .
464,"that's exactly what the little voice in my head says all the time ( sometimes in english, sometimes in german ).","exactly little voice head say time sometimes english , sometimes german ."
465,except i'm a very lazy person and i don't really like meat with lots of bones and stuff so i felt like when i tried pieces of sam's dish i was just playing with the food in my mouth.,except lazy person really like meat lot bone stuff felt like tried piece sam dish playing food mouth .
466,"i wake from my coma, sleep crusting my eyes.","wake coma , sleep crusting eye ."
467,my friends and i were at the beach a few weeks ago.,friend beach week ago .
468,i got to spend a few nights at my cousins house and it got me away from here to clear my head and just be in a different environment!,got spend night cousin house got away clear head different environment !
469,"not really creepy, but fairly interesting.","really creepy , fairly interesting ."
470,our 4th anniversary is in december.,th anniversary december .
471,"""jeff what is that?",jeff ?
472,"i was in the same outfit as at the party, with the addition of a voice changing microphone under the mask and a glow stick that i stuck in there to try to illuminate my eyes a bit.","outfit party , addition voice changing microphone mask glow stick stuck try illuminate eye bit ."
473,"in my head i just said, ""this is going to end badly.","head said , going end badly ."
474,i told myself i can't buy anything yet my hand just cant stop me for buying.,told buy anything yet hand cant stop buying .
475,it scratched them up but hardly hurt them.,scratched hardly hurt .
476,"fast forward to the wedding, it's small and intimate, probably less than 50 people there, and they have the reception at some hotel with a bar.","fast forward wedding , small intimate , probably less people , reception hotel bar ."
477,"to this day, the memory still brings chills.","day , memory still brings chill ."
478,we stop dead in our tracks.,stop dead track .
479,late yesterday afternoon my shoulder began to ache.,late yesterday afternoon shoulder began ache .
480,"so there i was only half paying attention to the food, expecting slightly biting, slightly chewy swiss cheese and getting instead a mouthful of something warm, richly soft, and so delicious i had to stop reading and close my eyes to savor it.","half paying attention food , expecting slightly biting , slightly chewy swiss cheese getting instead mouthful something warm , richly soft , delicious stop reading close eye savor ."
481,"on top of that, i have bruising damage on my shoulders from all the carry-on hauling.","top , bruising damage shoulder carry hauling ."
482,"`` i said, `` my lungs are black? ''","said , lung black ?"
483,""" and ""how far away is blah blah?"".",far away blah blah ? .
484,"i chuckled, holding my hands up, and sat down in my comfy swivel chair.","chuckled , holding hand , sat comfy swivel chair ."
485,"we were both quiet, and i closed my eyes.","quiet , closed eye ."
486,"i managed to throw a strike to the guy after that, but it didn't feel right, which prompted me to turn to stropes and say, my arm is dead.","managed throw strike guy , feel right , prompted turn stropes say , arm dead ."
487,"anyway, i got into about 2 hours of extreme defense training, i suddenly starting developing a headache right in the center of my forehead.","anyway , got hour extreme defense training , suddenly starting developing headache right center forehead ."
488,"after that, i went to throw the plastic bowls for tiramisu and my stomach acted up and i felt a little like puking.",", went throw plastic bowl tiramisu stomach acted felt little like puking ."
489,"one day during practice, the question was read, ""finish, the opening line of the traditional american song which begins, 'i wish i was-'""","one day practice , question read , finish , opening line traditional american song begin , wish"
490,"my heads a mixture of emotions and im full of cold yet again, cant seem to shift nothing lately.","head mixture emotion im full cold yet , cant seem shift nothing lately ."
491,"i walk right over to the tv, stand face to face with it, and begin to point at the little number areas.","walk right tv , stand face face , begin point little number area ."
492,"i went, but i was afraid to go to sleep.","went , afraid go sleep ."
493,"i kept my head clear with guaifenesin and benadryl, putting me to sleep on the first part of the trip, which was flying from columbus to baltimore to join up with the family.","kept head clear guaifenesin benadryl , putting sleep first part trip , flying columbus baltimore join family ."
494,i had something *very* similar happen to me.,something similar happen .
495,"she threw her clothes all over the floor that's when i closed the door you should have seen the look in my eyes, woo oooo when i got the next surprise.","threw clothes floor closed door seen look eye , woo oooo got next surprise ."
496,then proceeded to duck and run past him into the female restroom.,proceeded duck run past female restroom .
497,"as usual, i was attempting to jump off as far as i could go.","usual , attempting jump far could go ."
498,i was like wtf?,like wtf ?
499,my ear had finally managed to clear on saturday and i could hear properly-hurrah!,ear finally managed clear saturday could hear properly hurrah !
500,"upon jumping off of the platform, there was an immediate drop for about 10 feet and then i went speeding across the wire for about the length of a football field with my hands and legs free.","upon jumping platform , immediate drop foot went speeding across wire length football field hand leg free ."
501,"smooshed between him and kh, who entertained this man with a long chat, i tried hard not to be rude as i turned my face away from the reek.","smooshed kh , entertained man long chat , tried hard rude turned face away reek ."
502,i swear my heart halted for a split second before sprinting.,swear heart halted split second sprinting .
503,i think my eyes shut immediately after my head hit that pillow.,think eye shut immediately head hit pillow .
504,he came yelling and screaming in my face slipping on me.,came yelling screaming face slipping .
505,my heart starts pounding just looking at it and all the thoughts of telling john to leave have wandered out of my head for the moment.,heart start pounding looking thought telling john leave wandered head moment .
506,( my teeth were chattering so much that i had to open my mouth riding down.,teeth chattering much open mouth riding .
507,i was also sick and running a fever.,also sick running fever .
508,that day was a lovely day for people on the internet.,day lovely day people internet .
509,long story short i ended up with a burst eardrum.,long story short ended burst eardrum .
510,"we went to this bar and after a little while if i took a morning run i could get a small cup of orange juice, my favorite kind of juice and a small treat.","went bar little took morning run could get small cup orange juice , favorite kind juice small treat ."
511,the nightmares and fear were new and inexplicable.,nightmare fear new inexplicable .
512,"i woke up at 8am, went to class in the shitty cold rain.","woke , went class shitty cold rain ."
513,i'm suffocating on my consciousness as it slowly seeps down my throat.,suffocating consciousness slowly seeps throat .
514,< 3 so i can now officially say that chicago holds my heart in more ways than one.,officially say chicago hold heart way one .
515,so fly we did.,fly .
516,maybe it was my inability to move my legs several days after.,maybe inability move leg several day .
517,that's when tears streak down my cheeks.,tear streak cheek .
518,"lisa appeared very ""distant"" to her, with a very ""dreamy"" demeanor.","lisa appeared distant , dreamy demeanor ."
519,"by the end of the class, my legs felt like jelly.","end class , leg felt like jelly ."
520,"clear windows to a soul too new in life, on the job, to possibly have seen more pain than watching me hold ice to my face, wiping blood off my mouth, wincing as i was inspected for injuries more severe than the bruises, the cuts, the bleeding.","clear window soul new life , job , possibly seen pain watching hold ice face , wiping blood mouth , wincing inspected injury severe bruise , cut , bleeding ."
521,"so i waved and walked on, and then realized several steps later that i'd been walking while he had the right of way... also, at one point a cyclist ran into my shoulder.","waved walked , realized several step later walking right way also , one point cyclist ran shoulder ."
522,my head turned to the side and my muscles relaxed.,head turned side muscle relaxed .
523,i'm nervous because nothings literally going in my head but yeaa.,nervous nothing literally going head yeaa .
524,not as bad as your story.,bad story .
525,"i burn out my legs biking there at top speed, having to scale a pretty high bridge, and speed into the parking lot at around 8:58.","burn leg biking top speed , scale pretty high bridge , speed parking lot around : ."
526,can i add a bridesmaid-zilla story?,add bridesmaid zilla story ?
527,"the starfish lay by my feet, its back turned to me.","starfish lay foot , back turned ."
528,"you know, there are not many possessions in this world that i hold more dear than the ring that my husband placed on my fingers eight years ago, this past christmas eve, and asked me to become his wife.","know , many possession world hold dear ring husband placed finger eight year ago , past christmas eve , asked become wife ."
529,"my throat is now only a dull ache ( as one nurse said, strep throat is the throat you don't forget, boy was she right! )","throat dull ache one nurse said , strep throat throat forget , boy right !"
530,we intentionally had a very short ceremony planned so people could get to the reception.,intentionally short ceremony planned people could get reception .
531,i will probably die never knowing more of him.,probably die never knowing .
532,now when i have too much to do my brain just gets distracted by all the other jobs jostling for attention.,much brain get distracted job jostling attention .
533,my heart start to get tire because i do nt know what i am doing all these for.,heart start get tire nt know .
534,i thought my heart was beating so fast.,thought heart beating fast .
535,naming a black lab leroy is not racist.,naming black lab leroy racist .
536,"he looks over and i realise how obvious i am with a huge grin on my face, looking suspicious.","look realise obvious huge grin face , looking suspicious ."
537,"and i got ta tell you right here folks, that brings a tear to my eye.","got ta tell right folk , brings tear eye ."
538,my leg is painful...... this time i got bought a lot of new cloths... my bro also... shoe is like normal one.,leg painful time got bought lot new cloth bro also shoe like normal one .
539,"my eyes were closed, but i could tell he was just staring at me, figuring out what to do with me.","eye closed , could tell staring , figuring ."
540,i never spent the night there..,never spent night
541,"i broke trail into the snow, my low-cut sneakers not doing enough to keep snow away from my feet.","broke trail snow , low cut sneaker enough keep snow away foot ."
542,they dance and shiver and grin and laugh.,dance shiver grin laugh .
543,"my father, dr. sanjay","father , dr. sanjay"
544,"after that class, i proceeded to `` work '' ( an $ 8 an hour gig where i sit in front of computer and once in maybe 4 hours change printer paper ) where i began studying for my linguistics test to be dropped in my face at 1 pm.","class , proceeded work $ hour gig sit front computer maybe hour change printer paper began studying linguistics test dropped face pm ."
545,"my eye is black, my head hurts, but i'm happy, i won.","eye black , head hurt , happy , ."
546,"i racked my brain, constituting the list of must-haves to funny, with some romance.","racked brain , constituting list must have funny , romance ."
547,i walked last night for about 45 minutes and i thought i was going to collapse due to my legs just not working anymore!,walked last night minute thought going collapse due leg working anymore !
548,i was absolutely livid.,absolutely livid .
549,"a few days later, the rash broke out into these weird bumps that itched like crazy, and spread to my stomach.","day later , rash broke weird bump itched like crazy , spread stomach ."
550,"cmon, mister, he said.","cmon , mister , said ."
551,it wasn't on my shoe anymore.,shoe anymore .
552,"i also injured my neck-it hurt so bad yesterday that it was all i could do for a few hours to sit in the recliner with a hot pad on my neck, watching friends and shoving max every time he jumped on my bruised thighs.","also injured neck hurt bad yesterday could hour sit recliner hot pad neck , watching friend shoving max every time jumped bruised thigh ."
553,because monday night was such a wonderful time and i intend to carry it in my heart as a precious treasure.,monday night wonderful time intend carry heart precious treasure .
554,then i had a reaction to a medication that almost closed my throat.,reaction medication almost closed throat .
555,"i watched it fly at the apple and vanish... never to be seen again, i scoured the area (flat grass) for years afterwards.","watched fly apple vanish never seen , scoured area flat grass year afterwards ."
556,so i go to the doctor and i tell him about getting the sharp pain in my back and how that hasn't gone away and how my hand is numb.,go doctor tell getting sharp pain back gone away hand numb .
