id,text,final_text
1130,"of course, in the end i had a better essay to hand in ( can't remember how this impacted the grade ) but i didn't feel like the work i was turning in was mine.so when i'm editing jenn's work a shiver runs down my spine that my father is also standing above my shoulder editing my edits.","course , end better essay hand remember impacted grade feel like work turning mine.so editing jenn work shiver run spine father also standing shoulder editing edits ."
1131,had to move from where i was born/brought up just to be rid of the hassle!,move born brought rid hassle !
1132,heart racing as well.,heart racing well .
1133,a song started to loop inside my head.,song started loop inside head .
1134,"`` when i came round i was on medication and morphine, i had a lot of pain in my face.","came round medication morphine , lot pain face ."
1135,i was teaching an introductory philosophy course at a major american university.,teaching introductory philosophy course major american university .
1136,thanks a lot mom and dad...,thanks lot mom dad
1137,"and to hear about you putting this relationship down, and even betting to see how long this can last, breaks my heart.","hear putting relationship , even betting see long last , break heart ."
1138,a crowd had gathered.,crowd gathered .
1139,i'm not sure i really even knew what the movie was about by the time it was done because my nerves were completely shot.,sure really even knew movie time done nerve completely shot .
1140,""" this was 2 weeks before christmas, the best business of the year.","week christmas , best business year ."
1141,still not quite understanding what i was seeing i nervously called out my friend's name.,still quite understanding seeing nervously called friend name .
1142,it was so cold.,cold .
1143,"it took a while, but i got my zen thing going and tapped to a song in my head.","took , got zen thing going tapped song head ."
1144,"i would slowly drift to sleep, only to awaken at 3:02am falling from the ceiling on to my bed.","would slowly drift sleep , awaken : falling ceiling bed ."
1145,"the noise repeated several times, and then ended.","noise repeated several time , ended ."
1146,and then my cheeks get even redder.,cheek get even redder .
1147,it scratched them up but hardly hurt them.,scratched hardly hurt .
1148,she left in a huge hurry leaving me with the overflowing toilet after her giant dump.,left huge hurry leaving overflowing toilet giant dump .
1149,so basically 14-15 hours after i ate my food was still in my stomach.,basically hour ate food still stomach .
1150,"this, too, scared the hell outta me.",", , scared hell outta ."
1151,"my head was spinning as the smoke i gladly inhaled made its way to my lungs and on its way out, the rings easily dissipating into the cold air made me wonder about him for the tenth time on that night.","head spinning smoke gladly inhaled made way lung way , ring easily dissipating cold air made wonder tenth time night ."
1152,"i've never been able to explain it properly, or provide full detail...","never able explain properly , provide full detail"
1153,"there were a few storage boxes in the laundry room, including some old stuffed toys and craft supplies.","storage box laundry room , including old stuffed toy craft supply ."
1154,thankfully i was found the next day by a security guard.,thankfully found next day security guard .
1155,i think it gets me into less trouble to be able to type but still keep my eyes and face turned to my teacher.,think get less trouble able type still keep eye face turned teacher .
1156,i always like to head out into the boonies after i have been away for a long time... to get my head straight.,always like head boonies away long time get head straight .
1157,i opened my eyes.,opened eye .
1158,"still starved for human interaction, i say okay.","still starved human interaction , say okay ."
1159,first day of school.,first day school .
1160,then my stomach got upset.,stomach got upset .
1161,they were coal black.,coal black .
1162,sorry to hear that.,sorry hear .
1163,"the next night, at the exact same time, the same thing happened.","next night , exact time , thing happened ."
1164,"yes yesh folkies, im here on this frightful abomination of a night once more hopin its all gravy with urselves because as for me not a lot is too different, its al good an im chilled, high, with a big grin on my face i do nt know why cause the only thing i got right now apart from some good smoke is a big fat fucken wad of cash muahaha.","yes yesh folkies , im frightful abomination night hopin gravy urselves lot different , al good im chilled , high , big grin face nt know cause thing got right apart good smoke big fat fucken wad cash muahaha ."
1165,i had an out of body experience that might have been a dream but it was entirely too vivid and real for me to believe that.,body experience might dream entirely vivid real believe .
1166,the other night i was on my way to bed and i stopped in the bathroom to brush my teeth.,night way bed stopped bathroom brush teeth .
1167,i hide my face and become someone else for a little while.,hide face become someone else little .
1168,my pride hurt worse than my leg did.,pride hurt worse leg .
1169,then they kill him.,kill .
1170,this happened like 10 years ago.,happened like year ago .
1171,at first i thought i ripped off skin when i blew my nose to get that insane crusty booger out but.,first thought ripped skin blew nose get insane crusty booger .
1172,"i just have all the feelings, emotions, and doubts running through my head, and i just do nt know how to deal with them.","feeling , emotion , doubt running head , nt know deal ."
1173,my skin was still so soft.,skin still soft .
1174,the black lady was completely offended and started screaming at us.,black lady completely offended started screaming u .
1175,my throat was covered by something and i didn't know what was going on.,throat covered something know going .
1176,i really thought that he was going to hit us.,really thought going hit u .
1177,"fake pokey sticks at 4 am are a good choice, plus my legs hurt like crazy the rest of the night.","fake pokey stick good choice , plus leg hurt like crazy rest night ."
1178,"these posts are crushing, so read this.","post crushing , read ."
1179,"and yes, that's a true story.","yes , true story ."
1180,i am a very awkward person.,awkward person .
1181,my mom decided to hire some actors to hang out as the mighty morphin' power rangers.,mom decided hire actor hang mighty morphin power ranger .
1182,"i saw some of the girls staring but they didn't say anything, well not to my face.","saw girl staring say anything , well face ."
1183,the church was dark and empty.,church dark empty .
1184,he also had me march in place and stop to see how my feet naturally align.,also march place stop see foot naturally align .
1185,she is a genuinely nice girl.,genuinely nice girl .
1186,""" the man told her that he had and she said, ""well, i might as well tell you the story.","man told said , well , might well tell story ."
1187,"needless to say, the squirt gun game ended quickly.","needless say , squirt gun game ended quickly ."
1188,she was super excited until she asked if money was in it.,super excited asked money .
1189,"all this time, i believed in my theory that my eyes are `` sepet '' because my ancestor was married with a ( i told my friends about that theory of mine, and most of them believed in it ) and we rarely go back to her father's house at so as soon as i get back home, i asked her and she was like, i knew it i knew it ~ i planned something.","time , believed theory eye sepet ancestor married told friend theory mine , believed rarely go back father house soon get back home , asked like , knew knew planned something ."
1190,"obviously, she's pissed.","obviously , pissed ."
1191,"i have never seen him cry, ever.","never seen cry , ever ."
1192,someone wrapped a towel around my shoulders.,someone wrapped towel around shoulder .
1193,our parents had an ugly divorce and we were sort of parentless.,parent ugly divorce sort parentless .
1194,suddenly everything goes dark.,suddenly everything go dark .
1195,i heard a loud noise ( in the form of dr. a saying ` no ' ) and my feet skidded in panic under me; i couldn't get away fast enough.,heard loud noise form dr. saying foot skidded panic get away fast enough .
1196,"so i felt my stomach, felt that it was hard, and told robert what was going on.","felt stomach , felt hard , told robert going ."
1197,"that one, izabella, fell into the hot tub.","one , izabella , fell hot tub ."
1198,"all those feelings which he had buried deep in his heart, had now, after hundreds of years, risen up.","feeling buried deep heart , , hundred year , risen ."
1199,"dogs spirit into the afterlife, very strange.","dog spirit afterlife , strange ."
1200,"my cell phone started ringing, and the phone number that came up was one that i didn't recognize... thinking it might be a potential employer, i answered it.","cell phone started ringing , phone number came one recognize thinking might potential employer , answered ."
1201,"at first i thought it was a rotten orange, black and decaying, among a spoiled nest of old bones.","first thought rotten orange , black decaying , among spoiled nest old bone ."
1202,"each one of these could be a post all its own, but for the sake of time i'll simply list them:","one could post , sake time simply list :"
1203,he was beyond nasty.,beyond nasty .
1204,"i managed to pull myself up, my leg was hurting, but only a little.","managed pull , leg hurting , little ."
1205,it brings tears to my eyes just thinking about it.,brings tear eye thinking .
1206,"by sharlyn guthrie from the sea fate called to me, harmless ` round my ankles danced.","sharlyn guthrie sea fate called , harmless round ankle danced ."
1207,"there was a known, violent mentally-ill person named ""chop"" in a neighborhood i worked in.","known , violent mentally ill person named chop neighborhood worked ."
1208,i remember sitting on the bed in my pajamas closing my eyes and wondering why chocolate was so secretive.,remember sitting bed pajama closing eye wondering chocolate secretive .
1209,"i rolled my eyes while following behind kathy.then the voice from behind me sternly said, `` are you talking to me?!!!","rolled eye following behind kathy.then voice behind sternly said , talking ? ! ! !"
1210,grandma died of an massive heart attack before our daughter was born.,grandma died massive heart attack daughter born .
1211,"i feel my head hurting, and the next thing i know school's over, i'm in the front of it with him and traci, and he's pointing a finger at me and sort-of-yelling-sort-of-talking, and saying `` you faker! ''","feel head hurting , next thing know school , front traci , pointing finger sort yelling sort talking , saying faker !"
1212,"mel and helene were so kind that they allowed us to drive their car for the day, allowing us time to return to santa monica so that i could $ finally $ stick my feet in the pacific!","mel helene kind allowed u drive car day , allowing u time return santa monica could $ finally $ stick foot pacific !"
1213,i quickly fell asleep.,quickly fell asleep .
1214,i ended up screaming my sneeze.,ended screaming sneeze .
1215,she looked bisexual dammit!,looked bisexual dammit !
1216,they did the same thing come mother's day but guess what?,thing come mother day guess ?
1217,"as the ocean roiled and seethed sturdy arms lifted my head, bidding me to simply breathe $ `` breathe! ''","ocean roiled seethed sturdy arm lifted head , bidding simply breathe $ breathe !"
1218,my back started aching.,back started aching .
1219,he kept trying to grab me in the water and play fight.,kept trying grab water play fight .
1220,"scripture `` how sweet are your words to my taste, sweeter than honey to my mouth! ''","scripture sweet word taste , sweeter honey mouth !"
1221,"the problem was, my brain was ready for a 22 mile ride, my body was not.","problem , brain ready mile ride , body ."
1222,the man from billards never saw him again.,man billards never saw .
1223,"i felt for it, but ended up having to open my eyes to actually find it.","felt , ended open eye actually find ."
1224,""" this was followed by a very creepy laugh.",followed creepy laugh .
1225,"my father turned to yell at us in the backseat, and we slammed into a man.","father turned yell u backseat , slammed man ."
1226,i asked my mother's friend if it would be okay if i took a stroll through the orchard.,asked mother friend would okay took stroll orchard .
1227,"got forcibly taken to the hospital, against my wishes (i was fine.","got forcibly taken hospital , wish fine ."
1228,"""wait... you're that -cookies and paint-??",wait cooky paint ? ?
1229,"i fell to my knees, my hands clutching at my temples.","fell knee , hand clutching temple ."
1230,ugh i know for sure i'm a do my eyebrows.,ugh know sure eyebrow .
1231,my eyes start closing and my body starts aching all over.,eye start closing body start aching .
1232,i was five and he was six.,five six .
1233,"anyway, i finished up and went back inside and decided to brush my teeth and straighten my shirttail, which had gotten twisted while sitting on the floor of the hall reading for two hours.","anyway , finished went back inside decided brush teeth straighten shirttail , gotten twisted sitting floor hall reading two hour ."
1234,"i think i screamed as my arm disappeared into the crack of the tree, my fire blazing at my spike of shock.","think screamed arm disappeared crack tree , fire blazing spike shock ."
1235,"then we parted ways, never to see each other again.","parted way , never see ."
1236,he also worse black gloves and a black ski mask.,also worse black glove black ski mask .
1237,the school was kind enough to give me three weeks vacation for standing up for my sister like that.,school kind enough give three week vacation standing sister like .
1238,"), and i've imagined an entire life for him, his family, and his friends.",", imagined entire life , family , friend ."
1239,but scratching my arms all night long is breaking my life.,scratching arm night long breaking life .
1240,as i walked through the waiting area i could not believe my eyes at what i saw.,walked waiting area could believe eye saw .
1241,i had been awake.,awake .
1242,"i found refuge for my heart that was scrapped together by my second girl friend, her name was amanda.","found refuge heart scrapped together second girl friend , name amanda ."
1243,then she opened up a package to reveal a small looking scalpel which she then used to `` prick '' my finger.,opened package reveal small looking scalpel used prick finger .
1244,"one day, i was wearing a lot of black: black pants, black blouse, black jacket.","one day , wearing lot black : black pant , black blouse , black jacket ."
1245,my heart sank.,heart sank .
1246,"i tilt my head down to examine the bottom of the glass to see that there is a large, open terrain where the gash does not touch.","tilt head examine bottom glass see large , open terrain gash touch ."
1247,"i don't ever use a thermometer, just my hands to `` check '' the kiddos... i get reminded of this when someone asks me how high their temperature is.","ever use thermometer , hand check kiddos get reminded someone asks high temperature ."
1248,i'm shitting my pants.,shitting pant .
1249,my heart felt whole when i re-realized i could help other people.,heart felt whole realized could help people .
1250,"this time, all he saw was redness.","time , saw redness ."
1251,"we then ran to my house and tried to calm down, nothing else happened that night.","ran house tried calm , nothing else happened night ."
1252,i remember looking at the dairy queen sign across the street because it directed my face away from the crowd of onlookers.,remember looking dairy queen sign across street directed face away crowd onlooker .
1253,"you make me smile like the sun, fall out of bed, sing like a bird, dizzy in my head... okay, so it's been quite a while since i've wrote last.","make smile like sun , fall bed , sing like bird , dizzy head okay , quite since wrote last ."
1254,"still weak in the knees, i followed him into the bedroom, where i remained undressed for the next half an hour as j finished demonstrating his dominance in ways that left more than just my knees feeling weak.","still weak knee , followed bedroom , remained undressed next half hour j finished demonstrating dominance way left knee feeling weak ."
1255,"i was so jealous, so hurt, my heart so blackened, the devastation so deep over something that happened 40 years ago.","jealous , hurt , heart blackened , devastation deep something happened year ago ."
1256,scared the hell outta me.,scared hell outta .
1257,"so he went a lil faster ( keep in mind we never went really fast ) and i lost the tray, hit my knee on the ground, and tried to hang on until he stopped!","went lil faster keep mind never went really fast lost tray , hit knee ground , tried hang stopped !"
1258,"`` my legs, gee.","leg , gee ."
1259,i've never actually ventured there myself but heard crazy stuff.,never actually ventured heard crazy stuff .
1260,"a scar started to appear on my left palm, low, opposite my thumb.","scar started appear left palm , low , opposite thumb ."
1261,"i had to drink water every 2 minutes to keep myself from being mummy-fied, though it didn't help my nose much.","drink water every minute keep mummy fied , though help nose much ."
1262,i didn't see it through but what i did see when i lifted my head was my wife coming up the street.,see see lifted head wife coming street .
1263,"at that point, i started to descend and landed at a perfect running speed.","point , started descend landed perfect running speed ."
1264,"""i don't have time to arrest drunk drivers because of all the murders, rapes, and robberies we have to deal with.","time arrest drunk driver murder , rape , robbery deal ."
1265,my heart dropped and i just replied `` no. '',heart dropped replied .
1266,i used to absolutely not drive if i drank at all.,used absolutely drive drank .
1267,"every time it happens, the beginning of the dream is a little longer.","every time happens , beginning dream little longer ."
1268,closest analogy i could come up with.,closest analogy could come .
1269,"there's not much information on it, but apparently it is somewhat historically accurate (though undoubtedly greatly exaggerated over the years.","much information , apparently somewhat historically accurate though undoubtedly greatly exaggerated year ."
1270,"i wandered down to the end of the block a couple times and caught bits of the band around the corner playing tom petty's, listen to her heart and the sultans of swing, the old dire straits song.","wandered end block couple time caught bit band around corner playing tom petty , listen heart sultan swing , old dire strait song ."
1271,"bloody scream at around 2am and again, nothing.","bloody scream around , nothing ."
1272,"every single time i found a girl that i was interested in, they always ended up finding some creative way to break my heart.","every single time found girl interested , always ended finding creative way break heart ."
1273,"by the time i caught the bus, i had an ankle the size of my waist and a throbbing pain to match it.","time caught bus , ankle size waist throbbing pain match ."
1274,":d as the night came, i woke up and found out that my lips are swollen!",": night came , woke found lip swollen !"
1275,"my vision repaired itself slowly, and the pain lessened, but the feeling that there was blood gushing out of my head didn't.","vision repaired slowly , pain lessened , feeling blood gushing head ."
1276,she's into extreme bondage.,extreme bondage .
1277,a highly intoxicated roommate and a black girl going at it.,highly intoxicated roommate black girl going .
1278,all of a sudden we were standing on the street corner waiting for the light to change so we could cross.,sudden standing street corner waiting light change could cross .
1279,there was mold growing in things.,mold growing thing .
1280,"it was absolutely mobbed because of the festival and the tattoo, clambering up and down the hills near enough killed both my mum and i ( my legs still aren't talking to me ) and it pelted it down from the heavens.","absolutely mobbed festival tattoo , clambering hill near enough killed mum leg still talking pelted heaven ."
1281,"sitting in a dark hallway, with flickering lights, always need to be flickering lights.","sitting dark hallway , flickering light , always need flickering light ."
1282,"only reason i looked is because some user said ""dreads are cool"".",reason looked user said dread cool .
1283,"we paid $269 for our standby tickets, and one first-class seat was about $11,000.","paid $ standby ticket , one first class seat $ , ."
1284,i'll never forget how businesslike and calm the israeli guy was.,never forget businesslike calm israeli guy .
1285,i start to freak.,start freak .
1286,i pretty much spent my whole entire new year's crying my eyes out.,pretty much spent whole entire new year cry eye .
1287,so apparently they met up at the motel.,apparently met motel .
1288,but there was peace in my heart.,peace heart .
1289,no one is there.,one .
1290,this man had a '60s haircut and outfit on and he was just casually staring out the window.,man haircut outfit casually staring window .
1291,"my back arched with every heave, and tremors ran up and down my spine.that went on for about 5 minutes.","back arched every heave , tremor ran spine.that went minute ."
1292,"whose is harder, doesnt matter.","whose harder , doesnt matter ."
1293,the job is made for me.,job made .
1294,his composure never displayed boredom.,composure never displayed boredom .
1295,between my legs.,leg .
1296,there was no stopping the relentless torrent.,stopping relentless torrent .
1297,"the feeling has started to come back to my eye, but i still cant raise my lip and actually inspect the damage.","feeling started come back eye , still cant raise lip actually inspect damage ."
1298,i woke up around 10:30 with a million thoughts rolling through my head.,woke around : million thought rolling head .
1299,"if i'd have had to wait on her to drive me home, that woulda been fucking terrible.","wait drive home , woulda fucking terrible ."
1300,"**the breakup** -- after we graduated, she abandoned her plans to go to grad school, broke up with me and moved to the other side of the world.","breakup graduated , abandoned plan go grad school , broke moved side world ."
1301,i've been thinking about it more and can't get my head around it.,thinking get head around .
1302,i wasn't hurt.,hurt .
1303,we stare at the monitor and see him head right to the kitchen utensils section.,stare monitor see head right kitchen utensil section .
1304,i used this primarily to keep in touch with my siblings.,used primarily keep touch sibling .
1305,i shoved him once pretty hard and put my fists up for a brawl.,shoved pretty hard put fist brawl .
1306,"as she came closer, i saw what she held and tears began misting in my eyes.","came closer , saw held tear began misting eye ."
1307,3:05 pm rose lemort said... it was 18 below here this morning ( boulder ) i guess it looked pretty but i was too busy trying not to freeze my lungs to really notice!,: pm rose lemort said morning boulder guess looked pretty busy trying freeze lung really notice !
1308,my heart sank.,heart sank .
1309,everyone was out in the detached garage smoking.,everyone detached garage smoking .
1310,then things get weird.,thing get weird .
1311,"i got there way too early since i'm all new at this, didn't bring enough stuff, and had far too much time on my hands.","got way early since new , bring enough stuff , far much time hand ."
1312,fast forward eleven years.,fast forward eleven year .
1313,i know this pain.,know pain .
1314,i was on my way down with 2 jars in my hands and full knowledge of the boxes upon boxes of glass jars surrounding me i am happy to report that only one jar was broken!,way jar hand full knowledge box upon box glass jar surrounding happy report one jar broken !
1315,i am stressed out.,stressed .
1316,"i was able to take a bath, which felt good while i was in it and now i feel horrible again, and i brushed my teeth, and washed my hair, so give me some kudos.","able take bath , felt good feel horrible , brushed teeth , washed hair , give kudos ."
1317,i haven't had a dream with them in it for years.,dream year .
1318,this girl faked a miscarriage.,girl faked miscarriage .
1319,it was late and they were asleep.,late asleep .
1320,he put a huge grin on my face.,put huge grin face .
1321,"i have in my hands two boxes, which god gave me to hold.","hand two box , god gave hold ."
1322,i saw a shadowy figure move past it.,saw shadowy figure move past .
1323,i thought my heart was beating so fast.,thought heart beating fast .
1324,i get the shivers to this day.,get shiver day .
1325,nothing out of the ordinary.,nothing ordinary .
1326,"the rest, i du n no, i can still feel it there, inside my head trying to bring me down again.","rest , du n , still feel , inside head trying bring ."
1327,the teacher was telling her things would get better and that the best way to escape bullies is to get awesome grades so that she would have universities begging her to attend school there.,teacher telling thing would get better best way escape bully get awesome grade would university begging attend school .
1328,"i think i got hit in the face with at least half the shells after i fired them, but even the hot metal briefly stinging me couldn't tear the grin off my face.","think got hit face least half shell fired , even hot metal briefly stinging tear grin face ."
1329,"amber, on the other hand, was missing a boyfriend.","amber , hand , missing boyfriend ."
